{
  "schemaVersion": 2,
  "releaseId": "vinsansi-r60-seq60-r60.35",
  "release": "2.4.0-R60.35",
  "releaseStage": "candidate",
  "generatedAt": "2026-09-22T19:35:00.000Z",
  "releaseSequence": 60,
  "issuedAt": "2026-09-22T19:35:00.000Z",
  "expiresAt": "2027-09-22T19:35:00.000Z",
  "productionReady": false,
  "resumeAllowed": false,
  "schemaTarget": "r60",
  "securityBaseline": "r60-security-baseline-v1",
  "signature": {
    "algorithm": "ed25519",
    "keyId": null,
    "signature": null
  },
  "resources": {
    "manager": {
      "sha256": "2fe9151de48c207ea6d26e3e915a93ec7c87ee7022f8d23080576140bc704890"
    },
    "worker": {
      "sha256": "385fb4ac59a87f77b40cd7eab0b61c78cc6804a64b6435e29593e8d506f37973"
    },
    "gateway": {
      "sha256": "4b91ba980a7f434cb84b5e103d1477cd4c6bb71490deac8b1a5c93f8fc89b564"
    },
    "capture": {
      "sha256": "fec360d561c45770cc56ba35e756f8c3b9762277a6f8205a7a93f9ee46c822f1"
    },
    "instagram": {
      "sha256": "f8826927aaf2d199f1e960ce47f3934433e697c37f76289af2870971449e20d7"
    },
    "mobile": {
      "sha256": "7f1ec4984d0ad7a42bfe802e3e556a380842cae5d424d7c8c5760bce8e34bc60"
    }
  },
  "imageDigests": {},
  "distribution": {
    "manager": {
      "kind": "windows-nsis",
      "url": null,
      "sha256": null
    },
    "mobile": {
      "kind": "android-apk",
      "url": null,
      "sha256": null
    }
  },
  "manager": {
    "toolId": "vinsansi_whatsapp_manager",
    "latestVersion": "1.5.93",
    "minimumSupportedVersion": "1.5.76"
  },
  "capture": {
    "toolId": "vinsansi_capture",
    "latestVersion": "1.0.53",
    "minimumSupportedVersion": "1.0.53"
  },
  "instagram": {
    "toolId": "vinsansi_instagram",
    "latestVersion": "2.0.8",
    "minimumSupportedVersion": "2.0.8"
  },
  "healthPolicy": {
    "runtimeTtlSeconds": 180,
    "managerHeartbeatSeconds": 60,
    "workerHeartbeatSeconds": 30
  },
  "components": {
    "worker": {
      "version": "3.14.8",
      "image": "vinsansi/dispatch-worker:3.14.8"
    },
    "gateway": {
      "version": "1.2.36",
      "image": "vinsansi/whatsapp-gateway:1.2.36"
    },
    "evolution": {
      "version": "0.7.2",
      "image": "evoapicloud/evolution-go:0.7.2"
    },
    "cloudflared": {
      "version": "2026.7.3",
      "image": "cloudflare/cloudflared:2026.7.3"
    }
  },
  "mobile": {
    "version": "0.1.15",
    "androidPackage": "studio.vinsansi.mobile"
  }
}
